source_id,society_seq,society,homepage_url
4210178237,1,Canadian Society of Plastic Surgeons,http://plasticsurgery.ca/
4210178566,1,American Association of Diabetes Educators,http://www.diabeteseducator.org/
4210179018,1,"DGPF Deutsche Gesellschaft für Photogrammetrie, Fernerkundung und Geoinformation","DGPF Deutsche Gesellschaft für Photogrammetrie, Fernerkundung und Geoinformation"
4210179146,1,International Sustainable Development Research Society (ISDRS),http://isdrs.org/
4210179180,2,Urological Association of Asia,http://uaanet.org/
4210179240,1,International Society for Nanomanufacturing (ISNM),https://www.isnm.org/
4210179635,1,Community Cancer Centers,http://accc-cancer.org/
4210180117,1,Australian Entomological Society,http://www.austentsoc.org.au/
4210180727,2,East China Normal University,https://www.ecnu.edu.cn/
4210181306,1,European Stroke Organisation,http://www.eso-stroke.org/
4210181343,1,The American Ceramic Society,https://ceramics.org
4210182064,1,International Union for Physical and Engineering Sciences in Medicine,http://www.iupesm.org/
4210182343,1,European Association of Urology,http://www.uroweb.org/
4210182462,1,Operational Research Society,http://www.theorsociety.com/
4210183152,1,International Association of Book and Paper Conservators,http://www.iada-home.org/en.html
4210183620,1,International Society for Technology in Education,https://www.iste.org/
4210183729,1,The Indian Institute of Packaging,https://www.iip-in.com/
4210183804,1,China Society of Automotive Engineers（China SAE),http://en.sae-china.org/
4210184545,1,British Dental Association,http://www.bda.org/
4210184564,1,National Art Education Association,http://www.arteducators.org/
4210184984,1,Portuguese Society of Cardiology,https://spc.pt/
4210185013,1,Indian Society of Remote Sensing,https://www.isrs-india.org/
4210185368,1,International Society on Thrombosis and Haemostasis,https://www.isth.org/
4210185667,1,British Association of Art Therapists,http://www.baat.org/
4210186268,2,European Society for Evolutionary Biology (ESEB),https://eseb.org/
4210186448,1,The Japan Society of Clinical Oncology,http://www.jsco.or.jp/english/
4210186739,1,The Royal Society for Public Health,https://www.rsph.org.uk/
4210186964,1,Canadian Anesthesiologists' Society,https://www.cas.ca/English/Home.aspx
4210187016,1,National Association for Kinesiology in Higher Education (NAKHE),http://nakhe.org/
4210187125,1,Mammal Research Institute of the Polish Academy of Sciences,https://ibs.bialowieza.pl/en/
4210187226,1,American Art Therapy Association,http://www.arttherapy.org/
4210187477,1,University Council for Educational Administration,http://www.ucea.org/
4210187585,1,Small Enterprise Association of Australia and New Zealand Ltd,http://seaanz.org/
4210187589,3,International Association for Womens’s Mental Health (IAWMH),https://iawmh.org/
4210188769,2,Institute of Coaching,https://instituteofcoaching.org/
4210188850,1,International Institute for Qualitative Inquiry,http://www.iiqi.org/
4210188992,1,Association for Physical Education,https://www.afpe.org.uk/physical-education/
4210189267,1,National Neonatology Forum,http://www.nnfi.org/
4210189328,2,Italian Association of Radiation Oncology (AIRO),https://www.radioterapiaitalia.it/
4210189435,1,Global Chinese Society for Computers in Education,http://www.gcsce.org/
4210189473,1,The British Mycological Society,http://www.britmycolsoc.org.uk/
4210189669,1,Association for the Advancement of Baltic Studies (AABS),http://www.balticstudies-aabs.org/
4210190227,1,The official journal of the Central States Communication Association (CSCA),https://www.csca-net.org/aws/CSCA/pt/sp/home_page
4210190235,1,International Council on Systems Engineering (INCOSE),http://www.incose.org/
4210190911,1,China Computer Federation (CCF),http://www.ccf.org.cn/
4210191406,1,"Plant Science and Biodiversity Centre, Slovak Academy of Sciences",
4210191715,2,Société Française de Recherche Opérationnelle et d'Aide à la Décision,http://www.roadef.org/societe-francaise-recherche-operationnelle-aide-decision
4210192566,1,Policy Studies Organization,http://www.ipsonet.org/
4210192832,1,"National Institute of Education, Singapore",http://www.nie.edu.sg/
4210193474,2,American Anthropological Association,http://www.americananthro.org/
4210193770,1,Influencing Social Policy,https://influencingsocialpolicy.org/
4210194329,1,British Ecological Society,https://www.britishecologicalsociety.org/
4210194606,1,International Association of Sedimentologists,http://www.sedimentologists.org/
4210194848,1,Aligarh Historians Society,http://aligarhhistorianssociety.com/
4210195045,1,Corrections Section of the ACJS,http://www.acjs.org/page/CorrectionsSection
4210195307,1,Chinese Institute of Environmental Engineering,http://www.cienve.org.tw/
4210195452,1,Fortune Institute of International Business,http://fiib.edu.in/
4210195826,1,Hammill Institute on Disabilities,http://www.hammill-institute.org/
4210196576,1,European Association of Social Psychology,http://www.easp.eu/
4210196929,1,Center for Public Resources,
4210197400,1,SIBE – School of International Business and Entrepreneurship,https://www.steinbeis-sibe.de/
4210197613,1,ASIS&T,https://www.asist.org/
4210198536,1,Public Health Association of Australia,http://www.phaa.net.au/
4210199159,2,Cochrane Complementary Medicine,https//cam.cochrane.org/
4210199948,1,International Association of Chinese Professionals in Geographic Information Sciences,http://www.cpgis.org/
4210200020,1,"Road, Housing and Development Research Center (BHRC)",http://ajce.bhrc.ac.ir/
4210200113,1,IACFS/ME,https://www.iacfsme.org
4210200161,1,Journal of Indian Council of Philosophical Research,http://icpr.in/
4210200243,1,la Asociación Mexicana de Gastroenterología,https://www.gastro.org.mx/
4210200477,1,Society for Post-Acute and Long-Term Care Medicine,https://paltc.org
4210200583,1,Academy of Consultation-Liaison Psychiatry,https://www.clpsychiatry.org/
4210200594,1,American Society for Reproductive Medicine,
4210200752,1,European Research Community on Flow Turbulence and Combustion,http://www.ercoftac.org/
4210200776,1,Shailesh J. Mehta School of Management,http://www.som.iitb.ac.in/
4210200887,2,The Haruv Institute,https://www.schusterman.org/the-haruv-institute
4210201308,1,Indian Institute for Human Settlements,http://iihs.co.in/
4210201671,1,European Federation of Biotechnology,http://www.efbiotechnology.org/
4210201749,1,International Academy of Oral Oncology,http://www.iaoo.pro/en/
4210202626,1,British Phycological Society,https://brphycsoc.org/
4210202800,1,The American Aging Association,https://www.americanagingassociation.org/
4210202872,1,Société Botanique de France,
4210202889,1,The Indian Institute of Metals - IIM,http://www.iim-india.net/
4210203134,1,"The Society for Mining, Metallurgy & Exploration",https://www.smenet.org/
4210203465,3,Group for the Advancement of Microsurgery,http://www.gam-sfm.org/
4210203649,2,American Association for Dental Research,http://www.iadr.org/AADR
4210204984,1,The American Society of Maxillofacial Surgeons,https://maxface.org/
4210205368,1,International Association of Providers of AIDS Care,http://www.iapac.org/
4210205774,1,International Association for Mathematical Geosciences,https://iamg.org/
4210206143,1,National Kidney Foundation,https://www.kidney.org/
4210206424,1,Ecological Society of China,http://english.rcees.cas.cn/sp/zgstxxh/
4210206830,1,Veterinary Ireland,http://www.veterinaryireland.ie/
4210206892,1,American College of Clinical Pharmacy (ACCP),
4210208472,1,Indian Academy of Sciences,https://www.ias.ac.in/
4210208553,1,Organization of the Petroleum Exporting Countries,http://www.opec.org/opec_web/en/
4210210637,2,Japan Society of Medical and Pharmaceutical Sciences for Traditional Medicine,https://www.wakan-iyaku.gr.jp/
4210211349,1,International Council on Systems Engineering (INCOSE),http://www.incose.org/
4210211542,3,Deutsche Vereinigung für Sportwissenschaft (dvs),https://www.sportwissenschaft.de/home/
4210211635,1,International Academy of Legal Medicine,http://www.ialm.info/
4210211745,1,China Association Against Epilepsy.,http://www.caae.org.cn/
4210212381,1,The Society of Light and Lighting,http://www.cibse.org/Society-of-Light-and-Lighting
4210212761,1,Texas Counseling Association,https://www.txca.org/tca/default.asp
4210214295,1,The Institution of Engineers (India),https://www.ieindia.org/
4210214434,1,National Association for Bilingual Education,http://www.nabe.org/
4210215073,1,Brain-Computer Interface Society,https://bcisociety.org/
4210215442,1,American Society of Retina Specialists,http://www.asrs.org/
4210215966,1,The International Society for Digital Earth,http://www.digitalearth-isde.org/
4210216082,2,QAPCO,https://qapco.com/
4210216201,3,Australian Knee Society,http://www.kneesociety.org.au/
4210216450,1,Indian Society of Victimology,http://isvindia.webs.com/
4210216685,1,American Academy of Clinical Neuropsychology,http://www.theaacn.org/
4210216950,1,Society for Academic Emergency Medicine,http://www.saem.org/
4210216991,2,The International Organization on Shape Memory and Superelastic Technologies,https://www.asminternational.org/web/smst/
4210217384,1,The Institute of Smart Structures & Systems,http://isssonline.in/
4210218319,1,Action against Medical Accidents (AvMA),http://www.avma.org.uk/
4210218682,1,Zhejiang University,http://www.zju.edu.cn/
4210218940,1,IAMCR,https://iamcr.org/
4210219362,1,National Dance Education Organization,http://www.ndeo.org/
4210219605,1,Chinese Society for Plant Pathology,http://www.cspp.org.cn/
4210219616,1,Korean Multi-Scale Mechanics,http://kmsm.or.kr/
4210220485,1,Kyung Hee Oriental Medicine Research Center,http://www.opem.org/
4210220544,1,American Society of Crime Laboratory Directors,https://www.ascld.org/
4210220616,1,The Society for Humanistic Anthropology,http://sha.americananthro.org/
4210220878,1,American Board of Professional Neuropsychology,http://abn-board.com/
4210221382,1,Indian Council of Philosophical Research,http://icpr.in/
4210221497,1,Beijing Jiaotong University,http://en.bjtu.edu.cn/
4210221739,1,Society for Mathematical Psychology,http://www.mathpsych.org/
4210222173,1,Society for the Medieval Mediterranean,http://www.societymedievalmediterranean.com/
4210222641,1,National Medical Association,https://www.nmanet.org/
4210222644,1,British Phycological Society,http://www.brphycsoc.org/
4210223581,3,Czech Society of Clinical Neurophysiology,http://www.neurofyziologie.cz/
4210223894,3,Österreichische Kardiologische Gesellschaft (ÖKG),http://www.atcardio.at/de/
4210224556,1,Middle Atlantic Shoulder and Elbow Society (MASE),http://www.mases.info/index.php/about-us
4210225662,1,"Institute of High Energy Physics, Chinese Academy of Sciences",http://www.ihep.cas.cn/
4210225678,1,Shandong University,https://en.sdu.edu.cn/
4210226373,1,Global Association of Human Trafficking Scholars,https://www.gahts.com/
4210226710,1,International Society for the Study of Emerging Drugs (ISSED),https://issed.net/
4210226981,1,Network for Social Work Management,https://www.socialworkmanager.org/
4210227051,2,ICCR,http://www.iccr-foundation.org/
4210227223,1,SHAPE America,http://www.shapeamerica.org/
4210227234,1,Royal Society of Medicine,http://www.rsm.ac.uk/
4210227849,1,Society for the Cognitive Science of Culture (SCSC),https://culturalbrain.org/scsc/
4210228472,1,ENERGY,https://www.journals.elsevier.com/energy
4210228557,3,Swiss Society of Neuroradiology (Schweizerische Gesellschaft für Neuroradiologie SGNR),http://www.swissneuroradiology.ch/home.html
4210228986,2,"Schweizerische Ärztegesellschaft für Akupunktur, Chinesische Medizin und Aurikulomedizin (SACAM)",https://sacam.ch/
4210229088,1,Centre de recherches mathématiques de l'Université de Montréal,http://www.crm.umontreal.ca/en/
4210229109,1,The Foundation for Gender-Specific Medicine,https://gendermed.org/
4210229617,1,"Umeå School of Education, Umeå University",http://www.umu.se/english/
4210230012,1,The Psychonomic Society,http://www.psychonomic.org/
4210230830,1,American Orthotic & Prosthetic Association,https://www.aopanet.org/resources/research/
4210230988,1,University of Michigan,https://umich.edu/
4210231160,1,Indian Institute of Dalit Studies,http://www.dalitstudies.org.in/
4210231370,1,Japan Society of Naval Architects and Ocean Engineers (JASNAOE),https://www.jasnaoe.or.jp/en/
4210231404,2,Beihang University,https://www.buaa.edu.cn/
4210231410,1,The Korean Society for Agricultural Machinery,http://www.ksam76.or.kr/
4210232136,1,American Academy of Advertising (AAA),http://www.aaasite.org/
4210232311,1,Sociedad Española de Enfermería Intensiva y Unidades Coronarias,https://seeiuc.org/
4210233192,1,Operational Research Society,http://www.theorsociety.com/
4210233397,1,American Association of Geographers,http://www.aag.org/
4210234653,2,Americas Committee for Treatment and Research in Multiple Sclerosis,http://www.actrims.org/
4210235199,1,"The Society for Education, Music and Psychology Research",http://www.sempre.org.uk/
4210235231,1,Canadian Association of Occupational Therapists/Association Canadienne des Ergotherapeutes,http://www.caot.ca/
4210236147,1,International Institute for Strategic Studies,http://www.iiss.org/
4210236488,1,Forum D' Analystes,https://sites.google.com/site/journalofanalysis/Forum-DAnalystes
4210236812,1,"Foundation of associations for social cause innovation, academics and learning",https://journals.sagepub.com/home/tmx
4210236857,1,American Society of Agronomy,https://www.agronomy.org/
4210237279,1,World Professional Association for Transgender Health,http://www.wpath.org/
4210237295,1,Architectural Institute of Japan,https://www.aij.or.jp/aijhome.htm
4210237306,1,Heart Rhythm Society,https://www.hrsonline.org/
4210237622,1,International Project Management Association (IPMA),https://www.ipma.world/
4210237802,1,International Association for Mathematical Geosciences,https://iamg.org/
4210238433,1,Korea National University of Education,https://en.knue.ac.kr/smain.html
4210239085,1,Vietnam Academy of Science and Technology,http://www.vast.ac.vn/en/
4210239529,1,Deutsche Gesellschaft für Kieferorthopädie e.V. (DGKFO),http://www.dgkfo.de/
4210240072,1,Small Enterprise Association of Australia and New Zealand Ltd,http://seaanz.org/
4210240585,1,American Geophysical Union,https://agu.org
4210240675,1,Chinese Anti-Cancer Association,http://www.caca.org.cn/english/
331060,1,Society of Cardiovascular Computed Tomography,http://www.scct.org/
531269,1,European Society of Emergency Nurses (EuSEN),
568598,1,Deutsche Gesellschaft für Gynäkologie und Geburtshilfe (DGGG),https://www.dggg.de/
920941,1,Inter-Society Color Council,http://www.iscc.org/
1342386,1,International Society of Electrochemistry,http://www.ise-online.org/
1353648,1,Canadian College of Health Leaders,http://www.cchl-ccls.ca/
1374498,1,American Counseling Association,https://www.counseling.org/
1558111,1,Policy Studies Organization,http://www.ipsonet.org/
1666925,1,International Soil Tillage Research Organization (ISTRO),http://www.istro.org/
2228914,1,Health Research and Educational Trust in cooperation with AcademyHealth.,http://www.hret.org/
2912548,1,Design Society,https://www.designsociety.org/
2940672,1,Buros Center for Testing,http://buros.org/
3992287,3,International Society of Pediatric Dermatology,http://www.ispedderm.com/
4138479,1,Mid-South Sociological Association,http://www.midsouthsoc.org/
4179095,1,American Statistical Association,http://www.amstat.org/
4398839,1,Institute of Control Robotics and Systems,http://eng.icros.org/
4789869,1,American Sociological Association,http://www.asanet.org/
4802544,1,Society of Urologic Oncology,http://suonet.org/default.aspx
5195456,1,the Department of Economic History,http://www.ekhist.uu.se/english.htm
5354126,1,British Institute in Eastern Africa,http://www.biea.ac.uk/
5382288,1,Union for International Cancer Control,http://www.uicc.org/
6118686,1,ACPA - College Student Educators International,http://www.myacpa.org/
6147291,1,World Society for Virology,https://www.ws-virology.org/
6284950,1,International Society of Obstetric Medicine,https://www.isomnet.org/Index.asp
6596815,1,Rural Sociological Society,http://ruralsociology.org/
6724074,1,The Research Journal of the College of Optometrists,http://www.college-optometrists.org/
7161550,1,Regional Studies Association and the RSAI British and Irish Section,http://www.regionalstudies.org/
7204592,2,American Association of Feline Practitioners,http://www.catvets.com/
7325069,1,International Federation for Cell Biology,http://www.ifcbiol.com/
8104296,1,la Société Française de Cardiologie,https://www.sfcardio.fr/
8264181,1,Policy Studies Organization,http://www.ipsonet.org/
8265502,1,International Biometric Society,https://www.biometricsociety.org/
8329894,1,The Association for Child and Adolescent Mental Health (ACAMH),https://www.acamh.org/
8481965,1,American College of Radiology,http://www.acr.org/
8600569,1,World Apheresis Association,http://www.worldapheresis.org/
9051360,2,Società Italiana di Fisica,https://www.sif.it/
9351502,1,Fisheries Society of the British Isles,http://www.fsbi.org.uk/
10544101,3,CAADRIA – Computer Aided Architectural Design Research in Asia,http://www.caadria.org/
10591207,1,International Sociological Association,http://www.isa-sociology.org/publ/is.htm
10615428,1,American Real Estate Society (ARES),https://www.aresnet.org
10731693,2,http://www.iee.jp/?page_id=1544,FALSE
11422300,1,The Korean Society of Mechanical Engineers,http://eng.ksme.or.kr/
12430390,1,International Association for Relationship Research,http://www.iarr.org/
12548615,1,Societies From the Global Field of Pediatric Urology,https://www.jpurol.com/content/societyinfo
12644804,1,International Society for Oncology and Biomarkers,https://www.isobm.org/
12713009,1,International Society for Genetic Eye Diseases and Retinoblastoma,http://isgedr.org/
12843035,1,British Association for Japanese Studies,http://www.bajs.org.uk/
12898181,1,Health Systems Global,https://healthsystemsglobal.org/
13342628,1,International Society for Adult Congenital Heart Disease,http://www.isachd.org/
13842274,1,British Pharmacological Society,
13968111,1,Association of Black Psychologists,http://www.abpsi.org/
14019644,1,Statistical Modelling Society,http://www.statmod.org/
14053799,1,East African Wildlife Society,http://www.eawildlife.org/index.php
14125373,1,Belgian Neurological Society,http://www.neuro.be/
14216896,1,Italian Society of Exercise and Sport Sciences,https://www.sismes.org/
14291815,1,Academy of Marketing,https://www.academyofmarketing.org/
14366549,1,Society for Promoting Christian Knowledge,http://spckpublishing.co.uk/
14376486,1,British Division of the International Academy of Pathology,
14626285,1,Royal Society Te Aparangi,https://royalsociety.org.nz/
14818408,1,International Cancer Imaging Society (ICIS),http://www.icimagingsociety.org.uk/
14949914,1,"Association for the Study of Law, Culture, and the Humanities",http://lawculturehumanities.com/
15609493,3,Society for the Study of Psychiatry and Culture (SSPC),https://psychiatryandculture.org/
16228288,1,Institute of Medical Illustrators (IMI),http://www.imi.org.uk/
17114410,1,International Environmetrics Society (TIES),http://www.environmetrics.org/
17425584,1,"A journal of the French National Institute for Agriculture, Food and Environment (INRAE)",https://www.inrae.fr/en
17551671,1,Australian Academy of Forensic Sciences,http://www.forensicacademy.org/
17753527,2,The International Association of Forensic Toxicologists,http://www.tiaft.org/
17762386,1,"European Urogynaecological Association, Collège National des Gynécologues et Obstétriciens Français, The European Board and College of Obstetrics and Gynaecology (EBCOG)","https://www.eugaoffice.org/, http://www.cngof.org/, https://www.ebcog.org/"
17986141,1,Western Academy of Management,http://www.wamonline.org/
18039248,1,The American Association of Public Health Dentistry,
18188872,2,"French Chemical Society (Société Chimique de France, SCF)",http://www.societechimiquedefrance.fr/?lang=fr
18670189,1,Belgian Society of Cardiology,https://www.bscardio.be/
18736814,1,INTERNATIONAL UNION FOR PURE AND APPLIED BIOPHYSICS,http://iupab.org/
19082065,1,Asian-Pacific Society on Thrombosis and Hemostasis,http://www.apsth.org/
19400458,3,Center for Evidence-Based Crime Policy,https://cebcp.org/
20470255,1,American Association of Hispanics in Higher Education,http://www.aahhe.org/
20715302,1,The International Union of Laboratories and Experts in Construction Materials Systems and Structures,http://www.rilem.net/
20980862,1,"CUNY School of Labor and Urban Studies, The Murphy Institute",http://newlaborforum.cuny.edu/
21165490,1,European Association for Vision and Eye Research (EVER),http://www.ever.be/news.php
21365710,1,Japanese Studies Association of Australia,http://www.jsaa.org.au/
21531271,1,Japanese Society of Animal Science,http://www.jsas-org.jp/HP-E/index-e.html
21693283,1,Society of Sensory Professionals,http://www.sensorysociety.org/
21763754,1,Nuclear Physics European Collaboration Committee NuPECC,http://www.nupecc.org/
21788410,1,Association for Research in Otolaryngology (ARO),http://www.aro.org/
21826315,2,Huazhong University of Science and Technology,http://english.hust.edu.cn/
22041155,1,Université Laval,http://www2.ulaval.ca/en/home.html
22523967,3,The Romanian Aesthetic Surgery Society (RASS),http://www.srce.ro/
22619840,1,Association for Fire Ecology,https://fireecology.org/
22675765,1,Australian Council for Educational Research,http://www.acer.edu.au/
22998730,1,Société française du Cancer,https://sfc.asso.fr/
23010633,2,https://www.jcer.or.jp/en,FALSE
23261908,1,Society for the Study of Christian Ethics,http://www.ssce.org.uk/
23625584,2,European Association for Veterinary Pharmacology and Toxicology,http://www.ecvpt.org/
23906263,1,Société entomologique de France,http://www.lasef.org/
24510010,1,World Ayurveda Foundation,http://www.ayurworld.org/
24905788,1,Plains Anthropological Society (PAS),http://www.plainsanthropologicalsociety.org/
25660060,1,Brazilian Society of Physical Therapy Research and Graduate Studies,http://www.abrapg-ft.org.br/
26596028,1,Netherlands Entomological Society,http://www.nev.nl/
27091128,1,American Society of Hand Therapists,http://www.asht.org/
27228949,1,Association for Psychological Science,http://www.psychologicalscience.org/
27405227,1,EcoHealth Alliance,https://www.ecohealthalliance.org/
27728379,1,Japan Society for Occupational Health,https://www.sanei.or.jp/?mode=view&cid=352
27819959,1,EpiGeneSys,http://www.epigenesys.eu/
27825752,1,Hammill Institute on Disabilities,http://www.hammill-institute.org/
28082686,1,Chinese Academy of Sciences (CAS),http://english.cas.cn/
28603624,1,German Society for Radiation Oncology (DEGRO),https://www.degro.org/
28768420,1,Canadian Association for Leisure Studies,http://www.cals.uwaterloo.ca/
28935041,1,Indian Council of Historical Research,http://ichr.ac.in/
29946585,1,European Foundation for Plant Pathology,https://www.efpp.net/
30045969,1,British Association for Sexual Health & HIV,http://www.bashh.org/
30799303,1,International Institute of Welding,http://iiwelding.org/
30982003,2,https://www.royensoc.co.uk/,FALSE
31181851,1,European Accounting Association,http://www.eaa-online.org/
31423397,1,French Society of Respiratory Diseases,http://splf.fr/
31588584,1,Association for University and College Counseling Center Directors,http://www.aucccd.org/
31777576,1,SCI (Society of Chemical Industry),https://www.soci.org/
31780008,1,European Association of Clinical Pharmacology & Therapeutics (EACPT),https://www.eacpt.eu/
32218721,1,Iran Polymer and Petrochemical Institute (IPPI),http://www.ippi.ac.ir
33368595,1,Society for Imprecise Probability: Theories and Applications (SIPTA),http://www.sipta.org/
33500248,1,Survey Review Ltd,http://www.surveyreview.org/
33606366,1,Zhejiang University,http://www.zju.edu.cn/
33781026,1,New Zealand Geographical Society,http://www.nzgs.co.nz/
34108376,1,International Society of Endovascular Specialists,http://www.isevsonline.org/
34139249,1,The RAND Corporation,https://www.rand.org/
34211650,1,EDP Sciences,https://www.edpsciences.org/en/
35071406,1,International Society for Infectious Diseases,http://www.isid.org/
35124825,1,Palestine Exploration Fund,https://www.pef.org.uk/
35213687,1,Chinese Ocean Engineering Society,http://www.oceaneng.cn/
35246616,2,Nippon Finance Association,https://nfa-net.jp/
35298862,1,Macromarketing Society,
35729010,1,Royal Danish Geographical Society,http://www.rdgs.dk/
36154601,1,Chinese Academy of Sciences,http://english.cas.cn/
36209479,1,DRUID Society,http://www.druid.dk/
36808561,1,International Association of Sedimentologists,http://www.sedimentologists.org/
36838616,1,International Society for Cell & Gene Therapy,https://isctglobal.org/
37614297,2,The Division on Autism and Development Disabilities of The Council for Exceptional Children,http://daddcec.org/Home.aspx
38148070,1,Finnish Society of Surgery,http://www.kirurgiyhdistys.fi/
38337076,3,Czech Society of Clinical Neurophysiology,http://www.neurofyziologie.cz/
38350834,1,Council of Supply Chain Management Professionals (CSCMP),http://cscmp.org/
38657515,1,World Association of Veterinary Anatomists,http://www.wava-amav.org/
38919146,1,Canadian Institute of Food Science and Technology (CIFST),http://www.cifst.ca/
39223014,1,Living Reviews,https://www.springer.com/gp/livingreviews/solar-physics
39839259,1,International Federation of Library Associations and Institutions,http://www.ifla.org/
39841227,1,International Institute of Forecasters,https://forecasters.org/
39924113,2,British Association of Paediatric Surgeons,http://www.baps.org.uk/
40391745,3,European Mechanical Circulatory Support Society,https://www.congresseums.com/
