source_id,society_seq,society,homepage_url
182001,1,National Association for Gifted Children,http://www.nagc.org/
1390998,1,Political Studies Association,http://www.psa.ac.uk/
2092408,2,http://www.acrnet.org/,FALSE
2181421,1,Society for Social Studies of Science,http://4sonline.org/
2280673,1,Association for the Study of Medical Education,http://www.asme.org.uk/
2329919,1,The British & Irish Association for Practical Theology,https://www.biapt.org/
2680034,1,Deutsche Gesellschaft für Internistische Intensivmedizin und Notfallmedizin (DGIIN),https://www.dgiin.de/
3234473,1,European Urban Research Association,http://www.eura.org/
3756010,1,SICOT - The International Society of Orthopaedic Surgery and Traumatology,http://www.sicot.org/
3992287,2,European Society for Pediatric Dermatology,http://www.espd.info/
4029648,1,Foundation for Veterinary Dentistry,http://veterinarydentistry.org/
4078192,2,Royal Swedish Academy of Sciences,http://www.kva.se/en/startsida
4847439,1,Chartered Institution of Water and Environmental Management,https://www.ciwem.org/
5303612,1,Association of periOperative Registered Nurses,https://www.aorn.org/
5444993,1,Institute of Geophysics of the Academy of Sciences of the Czech Republic,https://www.ig.cas.cz/en/
5745031,1,International Solar Energy Society,http://www.ises.org/
6139184,1,The Botanical Society of Japan,http://bsj.or.jp/index-e.php
6691161,1,African Association of Insect Scientists,http://aaisafrica.org/
8600569,4,Società Italiana di Emaferesi e Manipolazione Cellulare,http://www.emaferesi.it/
8734658,1,Japan Neuroscience Society,http://www.jnss.org/
8769598,1,Taiwanese Society of Biomedical Engineering,http://www.bmes.org.tw/
8788103,1,l'Association internationale de psychologie du travail de langue française (AIPTLF),https://www.aiptlf.net/
8901149,1,Canadian Psychiatric Association,http://www.cpa-apc.org/index.php
9351053,1,Eastern Finance Association,https://www.easternfinance.online/
9565702,1,International Mycorrhiza Society,http://www.mycorrhizas.org/
9600176,1,European Association for Research on Learning and Instruction,https://www.earli.org/
9856456,1,International Political Science Association,http://www.ipsa.org/
10201666,1,Society for Public Health Education,http://www.sophe.org/
10288104,1,European Association of Social Psychology,http://www.easp.eu/
10402646,1,American Alliance for Theatre & Education (AATE),http://www.aate.com/
10544101,2,ACADIA – Association of Computer Aided Design in Architecture,http://www.acadia.org/
10751480,1,European Society for Artifical Organs,http://www.esao.org/
11778488,2,American Anthropological Association,http://www.americananthro.org/
11852655,1,The American Association of Veterinary Parasitologists (AAVP),http://www.aavp.org/
12146737,1,International Society for Animal Genetics,http://www.isag.us/about.asp
12267756,1,Society for Laboratory Automation and Screening,http://www.slas.org/
12492028,1,Published on behalf of the International Institute for Conservation of Historic and Artistic Works,https://www.iiconservation.org/
12511572,2,The British Otorhinolaryngology & Allied Sciences Research Society (BOARS),https://www.entuk.org/boars-british-otorhinolaryngology-allied-sciences-research-society
13506822,1,American Psychosocial Oncology Society (APOS),http://www.apos-society.org/
13698240,2,Association of Rheumatology Health Professionals,
13872956,1,Hammill Institute on Disabilities,http://www.hammill-institute.org/
14468722,1,The Agricultural Economics Society,http://www.aes.ac.uk/
14586973,1,Society of Analytical Psychology,https://www.thesap.org.uk/
14856742,1,"Center for Italian Studies, Stony Brook University, NY",https://www.stonybrook.edu/italianstudies/
15409311,1,Voice Foundation,http://www.voicefoundation.org/
15609493,2,World Psychiatric Association,http://www.wpanet.org/
16559285,1,The Psychonomic Society,http://www.psychonomic.org/
17068196,1,Association for Tropical Biology and Conservation,https://tropicalbiology.org/
17185278,1,Public Administration Committee,http://public-administration-uk.org.uk/
17594912,1,Durham University,http://www.dur.ac.uk/
18188872,3,"Spanish Society for Analytical Chemistry (Sociedad Española de Química Analítica, SEQA)",https://www.seqa.es/
18307414,1,International Society for the History of Physical Education and Sport,http://ishpes.org/home/
18318442,1,National Communication Association,http://www.natcom.org/
18792341,1,Taiwan Fuzzy Systems Association (TFSA),http://www.fuzzy.org.tw/
18942856,1,The Psychonomic Society,https://www.psychonomic.org/
19143454,2,University of Science and Technology of China,https://en.ustc.edu.cn/
19171858,1,Australian Society of Exploration Geophysicists,https://www.aseg.org.au/
19400458,2,Campbell Collaboration,https://www.campbellcollaboration.org/
19605986,1,EURASIP – European Association for Signal Processing,http://www.eurasip.org/
19655492,1,National Children's Bureau,http://www.ncb.org.uk/
19769454,1,Australasian Society for Intellectual Disability (ASID),http://www.asid.asn.au/
20076162,1,European Association of Social Anthropologists,http://www.easaonline.org/
20419620,1,Association for Research in Post-Compulsory Education (ARPCE),http://arpce.org.uk/
21016770,1,Inter-University Seminar on Armed Forces and Society,http://www.iusafs.org/
21314667,1,Istituto di Informatica e Telematica del Consiglio Nazionale delle Ricerche,https://www.iit.cnr.it/en
21371779,1,Australasian College for Emergency Medicine,https://acem.org.au/
21476359,1,The Korean Institute of Power Electronics,http://www.kipe.or.kr/eng/
21531352,1,Sociedade Brasileira de Dermatologia,https://www.sbd.org.br/
21859746,1,The American Society for Composites,http://www.asc-composites.org/
22214007,2,http://www.ishd.org/,FALSE
22216877,1,Center for Translation Studies,http://translation.utdallas.edu/
22523967,2,Società Italiana di Chirurgia Plastica Ricostruttiva ed Estetica (SICPRE),http://www.sicpre.it/
22797964,1,Society for Urodynamics & Female Urology,http://www.ics.org/
23243006,1,British Veterinary Association (BVA),
23343376,1,European International Business Academy,https://www.eiba.org/r/home
23625584,3,American College of Veterinary Clinical Pharmacology,http://www.acvcp.org/
24165732,1,Spanish Society of Statistics and Operations Research,http://www.seio.es/index.php?lang=en
24354371,1,Society of Radiopharmaceutical Sciences,http://www.srsweb.org/
24603639,1,European Society of Rheology,https://rheology-esr.org/
25105827,1,Institute of Concurrent Engineering,http://icei.weebly.com/
25178087,1,International Pediatric Nephrology Association,http://www.ipna-online.org/
25199142,1,The Ludwik Hirszfeld Institute of Immunology and Experimental Therapy,https://www.iitd.pan.wroc.pl/en/Institute/
25376279,1,American Evaluation Association,http://www.eval.org/
25654872,1,Japanese Society for Neuroimmunology,http://www.neuroimmunology.jp/index-e.html
26113922,1,The Society for Post-Medieval Archaeology,http://www.spma.org.uk/
26173706,1,Deutsche Gesellschaft für Innere Medizin e.V. (DGIM),https://www.dgim.de/
26362423,1,Postcolonial Studies Association UK,https://www.postcolonialstudiesassociation.co.uk/
26598852,1,SPONSOR: Fondazione Edison,http://www.fondazioneedison.it/it/
26966653,1,Population Council,http://www.popcouncil.org/
27308184,1,Oxford Centre for Mission Studies,http://www.ocms.ac.uk/
27783554,1,Institut Henri Poincaré,http://www.ihp.fr/en
28330355,1,The Korean Physical Society,http://www.kps.or.kr/
28349394,1,American Dairy Science Association,http://www.adsa.org/
28964699,1,International Academy of Sex Research,http://www.iasrsite.org/
29194541,1,The Liturgical Conference,http://www.liturgicalconference.org/
29534538,1,Monumenta Serica Institute,http://www.monumenta-serica.de/monumenta-serica/institute/index.php
30211177,1,"Society for the Psychology of Women, Division 35 of the American Psychological Association",http://www.apadivisions.org/division-35/
30638350,1,National Council on Measurement in Education,http://www.ncme.org/
30657385,1,The Society for Geology Applied to Mineral Deposits (SGA),https://e-sga.org/home/#
30841621,1,The Histochemical Society,http://histochemicalsociety.org/
30880287,1,Institute of Philosophy and Sociology of the Polish Academy of Sciences,http://www.studialogica.org/
31062579,1,International Council of Museums,https://icom.museum/
31493525,1,South African Association of Botanists,https://sabotanyblog.wordpress.com/
31634851,1,Teacher Education Division of the Council for Exceptional Children,http://www.tedcec.org/
31672787,1,European Society of Contraception and Reproductive Health,http://www.escrh.eu/
31690342,1,Strategic Management Society,http://strategicmanagement.net/
31976903,1,The Royal Geographical Society with IBG,http://www.rgs.org/
32061424,1,Royal Meteorological Society,https://www.rmets.org/
32190847,2,International Geriatric Fracture Society,http://www.geriatricfracture.org/
32314625,1,Population Council,http://www.popcouncil.org/
32591859,1,Peace History Society,https://www.peacehistorysociety.org/
32670438,1,Urban and Local Politics Section of the American Political Science Association,http://www.apsanet.org/section13
33108253,1,International Society of Bionic Engineering,http://www.isbe-online.org/?ui=english
34816297,2,Norwegian Psychological Association,https://www.psykologforeningen.no/
34872747,1,International Union of Biochemistry and Molecular Biology,https://iubmb.org/
35920007,1,European Association for Signal Processing,https://www.eurasip.org/
36489579,1,National Center for State Courts,http://www.ncsc.org/
36510773,2,Association of Applied Biologists,https://www.aab.org.uk/
37340297,1,Tusi Mathematical Research Group,https://profsite.um.ac.ir/~moslehian/tmrg.htm
37660120,1,Academy of Human Resource Development,http://www.ahrd.org/
37667796,1,World Federation of Hemophilia,http://www.wfh.org/
37853641,1,Institut Pasteur,https://www.pasteur.fr/fr/research-microbiology
38337076,2,Brazilian Society of Clinical Neurophysiology,http://www.sbnc.org.br/
38863834,1,Society for Terrorism Research,http://www.societyforterrorismresearch.org/
39250910,1,YOUNG Editorial Group,
39924113,3,American Pediatric Surgical Association,http://www.eapsa.org/
40080443,1,CAIPE,https://www.caipe.org/
40136177,1,"Nordisk Odontologisk Förening, (NOF) - the Scandinavian Division of the International Association for Dental Research (IADR)",http://www.iadr-nof.com/
40198776,1,International CCN Society,http://ccnsociety.com/index.html
40280859,2,"Division of Operation and Maintenance, Lulea University of Technology, Sweden",https://www.ltu.se/
40362259,1,Society for Cross-Cultural Research,http://www.sccr.org/
40391745,2,International Society for Mechanical Circulatory Support,https://www.ismcs.org/
40505786,1,American Society of Nuclear Cardiology,http://www.asnc.org/
40678964,1,Pennsylvania Prison Society,http://www.prisonsociety.org/
41010807,1,British Educational Research Association,http://www.bera.ac.uk/BCF
41582180,1,American College of Medical Toxicology,http://www.acmt.net/index.html
41663952,1,A Journal of the International Listening Association,https://listen.org/
41709181,1,American Society for Bioethics and Humanities (ASBH),http://www.asbh.org/
41786655,1,la Société Française de Dermatologie et de l'Association des Dermatologistes Francophones,
42225297,2,Österreichische Schmerzgesellschaft (ÖSG),https://www.oesg.at/
42421247,1,Association for Radiologic & Imaging Nursing (ARIN),https://www.arinursing.org/
42481033,1,Association of Professional Chaplains,http://professionalchaplains.org/index.asp
42573498,1,International Association of Sedimentologists,http://www.sedimentologists.org/
42686363,1,"Institute of Materials, Minerals & Mining",https://www.iom3.org/
43043541,2,European Society of Cardiovascular Radiology (ESCR),https://www.escr.org/
43555407,1,Nevin Scrimshaw International Nutrition Foundation,https://inffoundation.org/
43587112,1,Eastern Communication Association (ECA),http://www.ecasite.org/
43637407,1,RADMA,https://www.radma.net/
43667197,1,The Japanese Society of Neuropathology,http://www.jsnp.jp/en/
44033376,1,European Society of Paediatric Radiology (ESPR),http://www.espr.org/
44261829,1,Indian Psychiatric Society - South Zonal Branch,http://ipsszb.org/
44419007,1,International Sustainable Development Research Society (ISDRS),http://isdrs.org/
44433209,1,"Latin American Perspectives, Inc.",http://latinamericanperspectives.com/
44888363,1,International League of Associations for Rheumatology,http://www.ilar.org/
45445671,1,American Society for Reproductive Medicine,http://www.asrm.org/
46169546,1,Academy for Gerontology in Higher Education (AGHE),http://www.aghe.org/
46238352,1,Behavior Genetics Association (BGA),http://bga.org/
46483713,1,International Environmental Communication Association,http://theieca.org/
46670945,3,European Society for Haemapheresis,http://www.esfh.eu/
48180145,1,Association for Molecular Pathology (AMP) American Society for Investigative Pathology (ASIP),http://www.amp.org/ http://www.asip.org/
48298795,1,British Association for Counselling and Psychotherapy,http://www.bacp.co.uk/
49302835,1,"IFAC, the International Federation of Automatic Control",http://www.ifac-control.org/
49871393,1,French Society for the study of Diabetes,https://www.sfdiabete.org/
51087889,1,Association for Scientific Advancement in Psychological Injury and Law,http://www.asapil.net/
51135293,1,The European Society of Radiology,https://www.european-radiology.org/
51499954,1,"American Psychological Association, Society for the Teaching of Psychology (Division 2)",http://teachpsych.org/
51654951,1,"ESSKA - European Society of Sports Traumatology, Knee Surgery and Arthroscopy",https://www.esska.org/
51837974,1,The International Society for Ion Mobility Spectrometry,https://www.isims.info/
51939333,1,Hong Kong Society for Transportation Studies,http://www.hksts.org/
53533488,1,"Wuhan Institutes of Physics and Mathematics, Chinese Academy of Sciences",http://english.wipm.cas.cn/
53651343,1,Institution of Mechanical Engineers,http://www.imeche.org/home
53926609,2,Thermal Spray Society,https://www.asminternational.org/web/tss
54078964,1,"Institute of Botany, Academy of Sciences of the Czech Republic",https://www.ibot.cas.cz/en/
54083545,2,International Phytotechnology Society,http://www.phytosociety.org/
54158622,1,The American Institute for Maghrib Studies,http://aimsnorthafrica.org/
54255202,1,Royal Geographical Society with IBG,http://www.rgs.org/
55449769,1,Korean Meteorological Society,http://www.komes.or.kr/
55641825,1,Asia Research Institute of the National University of Singapore,http://www.ari.nus.edu.sg/
55943811,2,European Histamine Research Society,https://www.ehrs.org.uk/
55970647,1,American Fisheries Society,https://fisheries.org/
56397279,1,Botanical Society of China,http://http//www.botany.org.cn/
56399094,1,Division on Women and Crime of the American Society of Criminology,http://ascdwc.com/
56679652,1,Indian Ocean Research Group Inc.,https://indianoceanresearch.group/
57016439,1,British Society of Paediatric Dentistry,http://www.bspd.co.uk/
57027881,2,http://www.symbolicinteraction.org/,FALSE
57049600,1,Program on Negotiation at Harvard Law School,http://www.pon.harvard.edu/
57504206,2,African Society for Immunodeficiencies,http://asid-africa.org/en/
57770130,1,Florida State University College of Criminology and Criminal Justice,http://criminology.fsu.edu/center-for-criminology-public-policy-research/
58241369,1,Mayo Clinic,http://www.mayoclinic.com/
58498366,1,American Academy of Periodontology (AAP),
59042063,1,Crawford School of Public Policy at the Australia National University,
59248909,1,European Association of Urology,http://www.uroweb.org/
59289252,2,CEPS - Centre for European Policy Studies,https://www.ceps.eu/
59604070,1,Policy Studies Organization,http://www.ipsonet.org/
60093453,1,Australian Psychological Society,https://www.psychology.org.au/
60281869,1,British Educational Research Association (BERA),http://www.bera.ac.uk/
60318618,1,International Society of Surgery,http://www.iss-sic.com/
60865174,1,American College of Cardiology,https://www.acc.org/
61245073,1,American Society for Photobiology,http://photobiology.org/
61446109,1,The Tavistock Institute,http://www.tavinstitute.org/
62069514,1,Entrepreneurship Development Institute of India,http://www.ediindia.org/
62275304,1,Society for Imaging Informatics in Medicine,http://siim.org/
62375027,1,IPSA's Research Committee on the Structure and Organization of Government (SOG),http://sog27.org/
62595639,1,International Society of Biomechanics in Sports (ISBS),http://www.isbs.org/
62676688,1,Combustion Institute,http://www.combustioninstitute.org/
62820861,1,British Bryological Society,http://www.britishbryologicalsociety.org.uk/
62863702,1,Australian Society of Viticulture and Oenology,http://www.asvo.com.au/
62865007,2,American Association for Dental Research,http://www.iadr.org/AADR
62966998,1,Cancer Research UK,https://www.cancerresearchuk.org/
63018980,1,European Society for Engineering Education,http://www.sefi.be/
63099517,1,Australian Teacher Education Association (ATEA),http://www.atea.edu.au/
63107127,1,British Society for Plant Pathology,http://www.bspp.org.uk/
63783143,1,"Society for Biotechnology, Japan",http://www.sbj.or.jp/e/
64184962,1,International Society of the Learning Sciences,https://www.isls.org/
64250036,1,Society of Multivariate Experimental Psychology,http://www.smep.org/
65171370,1,Indian Academy of Sciences,https://www.ias.ac.in/
65486112,1,CIMNE,https://www.cimne.com/
65504228,1,European Photochemistry Association,https://www.photochemistry.eu/
65924262,1,Canadian Academic Accounting Association (CAAA),https://www.caaa.ca/
66163274,1,Association of Chinese Political Studies,http://www.acpsus.org/
66320806,2,Network for Advancement of Transfusion Alternatives,http://www.nataonline.com/
66394278,1,International Association for the Study of German Politics,https://www.iasgp.org/
66559934,2,The Society of Skeletal Radiology,http://www.skeletalrad.org/
66666449,1,Midwest Sociological Society,http://www.themss.org/
66787172,2,Failure Analysis Society,https://www.asminternational.org/web/fas/home
66787336,1,"The Oto-Rhino-Laryngological Society of Japan, Inc.",http://www.jibika.or.jp/english/index.html
66816338,1,Association of Psychologists in Academic Health Centers (APAHC),https://ahcpsychologists.org/
66857027,1,European Society for the Cognitive Sciences of Music,http://www.escom.org/
66898606,1,Indian Association of Cardiavascular & Thoracic Surgeons,http://www.iacts.org/
67393510,1,German Chemical Society,https://www.gdch.de/
67695068,1,Primary Care Diabetes Europe,https://www.pcdeurope.org/
67833540,1,"Association with the Centre for African Studies, University of Cape Town",http://www.africanstudies.uct.ac.za/
68257882,1,National Communication Association,http://www.natcom.org/
68463970,1,CIRET,http://www.ciret.org/
68802660,1,SFGBM,https://sfgbm.fr/
68913162,1,Chartered Institute of Library and Information Professionals,http://www.cilip.org.uk/
69220080,1,British Sociological Association,http://www.britsoc.co.uk/
69229622,1,British Society for Sport History,https://www.sportinhistory.org/
69248470,1,Royal Society Te Aparangi,https://royalsociety.org.nz/
69627091,1,Society for the Study of School Psychology,https://www.sssp-research.org/
69687699,2,ASM International,https://www.asminternational.org/
69801987,1,Sociedade Brasileira de Computação,http://www.sbc.org.br/index.php?language=2&subject=248
69840963,1,International Society of Psychiatric Mental-Health Nurses,http://www.ispn-psych.org/html/about_us.html
69872077,1,Association for Project Management (APM) and the International Project Management Association (IPMA),http://www.apm.org.uk/ and https://www.ipma.world/
70002872,1,Japanese Society of Pathology,http://pathology.or.jp
70191686,1,Japanese Society of Echocardiography,http://www.jse.gr.jp/en/index.html
70513841,1,Society for the Study of Addiction to Alcohol and other Drugs,http://www.addiction-ssa.org/
70661765,1,Society of Behavioral Sleep Medicine,https://www.behavioralsleep.org/
70928947,1,American Society for Pain Management Nursing,http://www.aspmn.org/
71191459,1,European Institute of Education and Social Policy,http://www.eiesp.org/
71291065,1,Orphanet,http://www.orpha.net/
71588376,1,The Institute of Public Administration of Canada,http://www.ipac.ca/
71860415,1,European Association of Developmental Psychology,http://www.eadp.info/
72071028,3,Norwegian Statistical Association,https://sites.google.com/site/statistiskforening/
72072742,1,Institute of Rural Management Anand,https://www.irma.ac.in/
72160414,1,Korea Water Resources Association,http://www.kwra.or.kr/eng/main/index.htm
72188638,1,International Society for Experimental Hematology,http://www.iseh.org/
72366220,1,János Bolyai Mathematical Society,http://www.bolyai.hu/index_en.htm
72530233,1,International Society for First World War Studies,http://www.firstworldwarstudies.org/
72772346,1,Association for Environmental Health and Sciences Foundation (AEHS),https://www.aehsfoundation.org/
72893657,1,"Department of Geography, National University of Singapore",http://www.fas.nus.edu.sg/geog/
72913437,1,Deutsche Krebsgesellschaft e.V. (DKG),https://www.krebsgesellschaft.de/
72944096,1,Diabetes UK,http://www.diabetes.org.uk/
72950743,1,United Association for Labor Education,http://www.uale.org/
73028643,1,The Classification Society,https://tcs.wildapricot.org/
73047979,1,British Association of Urological Nurses,https://www.baun.co.uk/
73080522,1,"Department of Educational Leadership, Policy, and Human Development at North Carolina State University",
73484101,1,Multimedia Archives,https://www.youtube.com/user/ijrrmultimedia
74916569,1,Occupational Therapy Australia Limited,https://www.otaus.com.au/
75230789,1,Royal Meteorological Society,https://www.rmets.org/
76397174,1,The Brazilian Society of Mechanical Sciences and Engineering,http://www.abcm.org.br/
76594230,1,Environment Institute of Australia and New Zealand,http://www.eianz.org/
76877748,1,ASPA,https://www.aspanet.org/
77033920,1,International Association for the Philosophy of Sport,International Association for the Philosophy of Sport
77082647,1,International Comparative Policy Analysis-Forum (ICPA-Forum),https://comparativepolicy.org/icpa-forum/icpa-forum-member-benefits/
77346633,1,Australian Linguistic Society,http://www.als.asn.au/
77500791,1,Chinese Society of Clinical Oncology (CSCO),http://www.csco.ac.cn/
77581241,1,Entomological Society of China,http://entsoc.ioz.ac.cn/
77999381,1,Australasian Palaeontologists,http://aap.gsa.org.au/
78692710,1,International Federation of Dental Hygienists,http://www.ifdh.org/
78792899,1,International Council for Small Business,https://icsb.org/
78926909,1,Very Large Databases Endowment Inc.,http://www.vldb.org/
79074319,1,American Academy of Clinical Neuropsychology,https://theaacn.org/
79162425,1,British Medical Ultrasound Society,http://www.bmus.org/
79173686,2,https://www.uib.no,FALSE
79187626,1,The European Society of Veterinary Dermatology,https://www.acvd.org/
79449806,1,Oikos Editorial Office,http://www.oikosoffice.org
79872515,1,Indian Ceramic Society,http://www.incers.org/
80110507,1,AASP - The Palynological Society,https://palynology.org
80347152,1,International Society for Third Sector Research (ISTR),http://www.istr.org/
80821584,1,The Japan Society of Ultrasonics in Medicine,http://www.jsum.or.jp/
80823180,1,Association for Critical Sociology,http://www.criticalsociology.org/
81083566,2,Crop Science Society of America,https://www.crops.org/
81103468,1,"Management Centre for Human Values, Indian Institute of Management, Calcutta",https://www.iimcal.ac.in/faculty/centers-of-excellence/management-center-for-human-values/management-center-for-human-values
81521204,3,Mathematical Sociology Section of the American Sociological Association,http://www.mathematicalsociology.org/
82098733,2,https://www.britishecologicalsociety.org/,FALSE
82178847,1,Economic Society of Australia,http://esacentral.org.au/
83170543,1,European Educational Research Association,http://www.eera.eu/
83254143,1,National Association of School Nurses,http://www.nasn.org/
83262020,2,https://www.iaaer.org/,FALSE
83451902,2,Israel Society of Colon and Rectal Surgery,http://www.iscrs.org/english.html
83557516,1,Canadian Society for Chemical Engineering,http://www.cheminst.ca/about/csche
84585612,1,American College of Lifestyle Medicine,http://www.lifestylemedicine.org/
84680275,1,Society of Chemical Industry,
84753440,1,Asia-Pacific Academic Consortium for Public Health,http://www.apacph.org/wp/
84837402,2,American Neurogastroenterology and Motility Society,http://www.motilitysociety.org/
85012985,1,Cognitive Development Society (CDS),https://cogdevsoc.org/
85245245,1,Commission on Legal Pluralism,http://www.commission-on-legal-pluralism.com/
85335245,2,University of Vilnius,https://www.vu.lt/en/
85680040,1,Society for Language Development (SLD),https://web.sas.upenn.edu/societyforlanguagedevelopment/
85837164,1,"CASI, and the official journal of CRSS-SCT",https://crss-sct.ca/
85906241,1,Interior Design Educators Council,http://www.idec.org/
85907422,1,American Geographical Society (AGS),https://americangeo.org/
85953240,1,Institute of Physics and Engineering in Medicine (IPEM),http://www.ipem.ac.uk/
86125002,1,European Association of Environmental and Resource Economists,https://www.eaere.org/
86387881,3,American Broncho-Esophagological Association,http://www.abea.net/
86419656,2,http://www.bda.uk.com/,FALSE
86486980,3,Japan Society of Andrology,http://www.j-andrology.org/
86633019,1,the Italian Society of Surgery,https://www.sicitalia.org/
86871763,2,American Medical Society for Sports Medicine,https://www.amssm.org/
86895130,1,British Association for Cytopathology,http://www.britishcytology.org.uk/
