source_id,society_seq,society,homepage_url
27861859,1,Association of Chartered Physiotherapists in Sports and Exercise Medicine,http://www.acpsm.org/
27883222,1,Royal Society for Public Health,https://www.rsph.org.uk/membership.html
28527816,1,American Society for Gastrointestinal Endoscopy,https://www.asge.org/
28603624,2,Scientific Association of Swiss Radiation Oncology (SASRO),https://www.sasro.ch/
28739527,1,German Society for Mammalian Biology,http://www.mammalianbiology.org/
28882882,1,European Group for Organizational Studies,http://www.egosnet.org/
29434542,1,Association with Ochsner Clinic Foundation,
29946585,2,The Royal Netherlands Society of Plant Pathology (KNPV),https://www.knpv.org/en
29972171,1,American Association of Physicists in Medicine,https://w3.aapm.org/org/
30045969,2,International Union against Sexually Transmitted Infections,http://www.iusti.org/
30435792,1,The Group Analytic Society International,http://groupanalyticsociety.co.uk/
30860797,1,International Liquid Crystal Society,http://www.lcinet.kent.edu/ILCS/main/
30889938,1,German Society for Forensic Medicine,https://www.dgrm.de/
30982003,1,The Royal Entomological Society,
31122987,1,The Genetics Society of Korea,http://www.kgenetics.or.kr/index.asp
31225034,1,The Association for Cultural Economics International (ACEI),http://www.culturaleconomics.org/
32114090,1,International Association for Mathematics and Computers in Simulation,http://www.research.rutgers.edu/~imacs/
32238705,1,International Clinical Phonetics & Linguistics Association (ICPLA).,http://www.icpla.org/SITE2007/index.php?ICPLA-HOME
32271328,1,International Association of Applied Psychology,http://www.iaapsy.org/
32573412,1,Society for Modeling and Simulation International (SCS),http://www.scs.org/
32664174,1,International Planning History Society (IPHS),http://www.planninghistory.org/
33142482,1,Royal Society Te Aparangi,https://royalsociety.org.nz/
33368595,2,Beliefs functions and Applications Society (BFAS).,http://www.bfasociety.org/
33606366,2,Zhejiang University Press,http://www.zjujournals.com
33876618,1,Beijing Normal University,http://psych.bnu.edu.cn/tabid/297/Default.aspx
34211650,2,Società Italiana di Fisica,https://www.sif.it/
35160907,1,FRAME - Fund for the Replacement of Animals in Medical Experiments,http://www.frame.org.uk/
35246616,1,Asian Finance Association,http://www.asian-fa.org/
35512523,1,The Society for Archaeological Sciences,http://www.socarchsci.org/
35573031,1,International Society of Behavioral Medicine (ISBM),http://www.isbm.info/
36154601,2,"Institute of Mountain Hazards and Environment, Chinese Academy of Sciences",http://english.imde.cas.cn/
36385850,1,Association for Teacher Education in Europe (ATEE),https://atee.education/
36550824,1,Catholic Medical Association,http://www.cathmed.org/
36570147,1,Consejo Superior de Investigaciones Científicas (Spanish Council for Scientific Research),http://www.iata.csic.es/
36718530,1,American Sociological Association,http://www.asanet.org/
36808561,2,European Association of Geoscientists and Engineers,http://www.eage.org/
37477851,1,American Council of Learned Societies,http://www.acls.org/
37614297,1,Hammill Institute on Disabilities,http://www.hammill-institute.org/
37667796,3,Hemostasis & Thrombosis Research Society,https://www.htrs.org/
37739784,1,Society for Personality and Social Psychology,http://www.spsp.org/
37879103,1,Society for Renaissance Studies,https://www.rensoc.org.uk/
37889505,1,Japanese Breast Cancer Society,http://jbcs.gr.jp/member/en/
37976914,1,American Water Resources Association,https://www.awra.org/
38337076,4,International Society of Intraoperative Neurophysiology.,http://www.neurophysiology.org/
38942883,1,David Davies Memorial Institute,http://www.aber.ac.uk/interpol/en/research/DDMI/DavidDavies.htm
39019318,1,The British Cartographic Society (BCS),http://www.cartography.org.uk/
39132018,1,Association of Child Psychotherapists,https://childpsychotherapy.org.uk/
39641122,1,American Counseling Association,http://www.counseling.org/
39794811,1,Society for Applied Microbiology,http://www.sfam.org.uk/
39924113,1,American Academy of Pediatrics,http://www.aap.org/
39924113,5,Pacific Association of Pediatric Surgeons,http://www.pacificassociationofpediatricsurgeons.org/
40489520,1,Royal Australasian College of Surgeons,http://surgeons.org/
40735159,1,Canadian Meteorological and Oceanographic Society,http://www.cmos.ca/
41010807,3,http://www.bera.ac.uk/,FALSE
41534456,1,Konsthistoriska Sällskapet/The Society of Art Historians,http://www.konsthistoriska.org/
41600865,1,American Orthopaedic Foot & Ankle Society,http://www.aofas.org/
41617351,1,Australian and New Zealand Society for Immunology,https://www.immunology.org.au/
42028863,1,Australian Social Policy Association,http://www.aspa.org.au/
42105605,1,VBIO Verbandsnachrichten,http://www.vbio.de/
42640028,1,International Society of the Learning Sciences,https://www.isls.org/
42986021,1,National Communication Association,http://www.natcom.org/
43349511,1,German Academic Society for Production Engineering (WGP),https://wgp.de/en/
43703656,1,Princeton Theological Seminary,https://www.ptsem.edu/
43764696,1,European Association for Research on Learning and Instruction (EARLI),http://www.earli.org/
44033376,3,Asian and Oceanic Society for Paediatric Radiology (AOSPR),http://www.aospr.org/
44038507,1,American Counseling Association,http://www.counseling.org/
44404461,2,http://alphakappadelta.org/,FALSE
44784542,1,The Korean Society for Plant Biotechnology,http://www.kspbt.or.kr/
45042403,1,Polish Academy of Sciences,https://pan.pl/
45789726,1,The Society of Population Ecology,https://www.population-ecology.jp/english/
45795350,2,SciEngine,http://engine.scichina.com/
45897893,1,International Society for Research on Aggression,http://www.israsociety.com/
46247591,1,American Academy of Physical Medicine and Rehabilitation (AAPM&R),
46670945,1,World Apheresis Association,http://www.worldapheresis.org/
46982553,1,The Royal Swedish Academy of Sciences,https://www.kva.se/en/startsida
47098207,1,International Society for Research on Emotion,http://isre.org/index.php
47192491,2,The European Association of Endoscopic Surgery,https://eaes.eu/
47246245,1,University of North Florida,http://www.unf.edu/
47380182,1,International Federation of Automatic Control,http://www.ifac-control.org/
47939261,2,Italian Society of Obesity (SIO),https://www.sio-obesita.org/
48050435,1,International Society for Structural and Multidisciplinary Optimization (ISSMO),https://www.issmo.net/
48277251,1,Crop Science Society of America,https://www.crops.org/
48447438,1,International Association of Empirical Aesthetics,http://www.science-of-aesthetics.org/
48625712,1,International Federation of Psychoanalytical Societies (IFPS),http://ifps.info/index_eng.php
48661868,2,Chinese Academy of Social Sciences,http://casseng.cssn.cn/
49025288,2,Romanian Society for Surgery of the Hand,http://rssh.ro/
49321836,1,Academy of Human Resource Development,http://www.ahrd.org/
49327401,1,North American Association of Sports Economists,http://www.byuresearch.org/naasportseconomists/
49345018,1,The Geographical Society of China(GSC),http://www.gsc.org.cn/channel.aspx?id=75
49440999,1,Cochrane Eyes and Vision,https://eyes.cochrane.org/
49645005,1,Royal Society of Medicine,http://www.rsm.ac.uk/
50265103,1,Geological Society of Japan,
50351660,1,ELIAMEP - The Hellenic Foundation for European and Foreign Policy,http://www.eliamep.gr/
50876694,1,The Fondation Maison des Sciences de l'Homme,http://www.fmsh.fr/
50925299,1,Italian Society for Ultrasound in Medicine and Biology,http://www.siumb.it/
51102485,1,International Society for the Study of Behavioural Development,http://www.issbd.org/
51141438,1,International Association of Applied Psychology,http://www.iaapsy.org/divisions/division13
51303964,1,Deutsche Gesellschaft für Kardiologie - Herz- und Kreislaufforschung e.V.,https://dgk.org/
51346222,1,British Fertility Society,http://www.britishfertilitysociety.org.uk/
51360982,1,"IFAC, the International Federation of Automatic Control",http://www.ifac-control.org/
51610931,1,Special Care Dentistry Association,http://www.scdaonline.org/
51642650,1,World Communication Association,http://wcaweb.org/
51654951,3,"ISAKOS - International Society of Arthroscopy, Knee Surgery and Orthopedic Sports Medicine",https://www.isakos.com/
52157898,1,National Society for Education in Art & Design,http://www.nsead.org/
52251279,1,European Association of Potato Research,http://www.eapr.net/
52333995,1,International Network for Economic Method (INEM),http://www.econmethodology.org/
52939411,1,Institute of Physics and Engineering in Medicine (IPEM),http://www.ipem.ac.uk/
53121397,1,NASPA - Student Affairs Administrators in Higher Education,http://www.naspa.org/
53605123,1,African Specialty Group of the American Association of Geographers,http://www.public.iastate.edu/~asg/homepage.htm
54115554,1,American Society for Virology (ASV),https://www.asv.org/
54913114,1,Policy Studies Organization,http://www.ipsonet.org/
56736983,2,European AIDS Clinical Society,http://www.eacsociety.org/
57173539,1,Teaching Statistics Trust (TST),http://teachingstatisticstrust.org.uk/
57293400,1,Society of South African Geographers,http://www.ssag.co.za/
58457832,1,World Gold Council,https://www.gold.org/
58727509,1,American Academy of Dermatology,http://www.aad.org/
58990993,1,Botanical Society of China,http://www.botany.org.cn/
59071098,1,International Network of Genocide Scholars,http://www.inogs.com/
59404955,1,Laboratory Animals Ltd Affiliated Societies,http://www.lal.org.uk/
59562046,1,Institute for Outdoor Learning,http://www.outdoor-learning.org/
60322365,1,Association for Applied Psychophysiology and Biofeedback,http://www.aapb.org/
60621485,1,American Sociological Association,http://www.asanet.org/
61859066,1,European Federation of Periodontology,https://www.efp.org/
62036463,1,Norwegian Centre for Child Research,http://www.ntnu.no/noseb/english
62072220,1,American Academy of Forensic Sciences,http://www.aafs.org/
62507270,2,Deutsche Gesellschaft für Neurologie (DGN),https://www.dgn.org/
63600306,2,Telemedicine and eHealth Forum of the Royal Society of Medicine,http://www.rsm.ac.uk/academ/fmttelem.php
63831852,1,Policy Studies Organization,http://www.ipsonet.org/
64145856,1,Neuroscience Peer Review Consortium,http://nprc.incf.org/
64825020,1,Japanese Society for Artificial Organs,http://www.jsao.org/english/
64923488,1,Graduate Theological Union,https://www.gtu.edu/
65236890,1,The Combustion Institute,https://www.combustioninstitute.org/pages/page35.php
65770309,2,European Society for Pediatric Neurosurgery,https://www.espneurosurgery.org/
66095140,1,Brazilian Society of Pediatrics,http://www.sbp.com.br/
66322279,1,Association of Pediatric Hematology/Oncology Nurses (APHON),http://www.aphon.org/
66330005,1,International AIDS Society,https://www.iasociety.org/
67154361,1,National Communication Association,http://www.natcom.org/
67739838,1,American Association of Geographers,http://www.aag.org/
67807940,1,Society for Applied Mathematics and Mechanics,http://www.gamm-ev.de/
68052740,1,British Society for Eighteenth-Century Studies,https://www.bsecs.org.uk/
68157034,1,Society for Reproductive Investigation,https://www.sri-online.org/
69024147,1,Institute of Policy Studies of Sri Lanka,http://www.ips.lk/
69331574,2,Hong Kong Society for Emergency Medicine and Surgery,http://www.hksems.org.hk/
69755223,1,Chemometrics Society,
70014682,1,Brazilian Society of Microbiology,https://sbmicrobiologia.org.br/
70092882,1,Society for Vascular Nursing,http://www.svnnet.org/
70371499,1,American College Health Association,http://www.acha.org/
70381317,1,Design Management Institute,http://www.dmi.org/
70522100,1,Royal Meteorological Society,https://www.rmets.org/
70681891,1,ASM International,https://www.asminternational.org/
70884739,1,The Korean Society of Pharmaceutical Sciences and Technology,http://www.kspst.or.kr/
70934194,1,The Korean Society of Oceanography (KSO),http://www.ksocean.or.kr/
71057445,1,Society for Medical Anthropology,http://www.medanthro.net/
71218591,1,Dutch Political Science Association,http://politicologie.nl/
72071028,1,Danish Society for Theoretical Statistics,http://www.dsts.dk/
72232612,1,American Association of Family & Consumer Sciences (AAFCS),http://www.aafcs.org/
72791832,1,Korean Society for Biotechnology and Bioengineering,http://www.ksbb.or.kr/eng/
72851247,1,National Federation of Modern Language Teachers Associations,https://onlinelibrary.wiley.com/page/journal/15404781/homepage/Society.html
73373472,1,Japan Radiological Society,http://www.radiology.jp/english/index.html
73408372,1,International Society of Paddy and Water Environment Engineering (PAWEES),http://pawees.net/
73449225,1,International Society for Plant Pathology,https://www.isppweb.org/
74519973,1,Association for Assessment and Research in Counseling (AARC),http://aarc-counseling.org/
74899632,1,UCLouvain,https://uclouvain.be/en/index.html
74917840,2,The Southwestern Finance Association,http://www.southwesternfinance.org/
74940757,1,The Institute of Brewing & Distilling (IBD),https://www.ibd.org.uk/home/
75230894,1,Association for Behavioral and Cognitive Therapies (ABCT),http://www.abct.org/Home/
75293123,1,European Early Childhood Education Research Association,http://www.eecera.org/
75462704,1,Swedish Association of Physiotherapists,http://www.fysioterapeuterna.se/In-English/
75480959,1,Italian Neurological Society,http://www.neuro.it/
75519821,1,American Society for Experimental Neurotherapeutics,http://asent.org/
76521652,1,International Association of Addictions and Offender Counselors,http://www.iaaoc.org/
76547072,1,International Union of Radioecology,http://www.iur-uir.org/en/
76633192,1,Journal of Business Ethics,
76925378,2,Japanese Society of Pediatric Surgeons,http://www.jsps.gr.jp/
77092102,2,Chinese Mathematical Society,http://www.cms.org.cn/
77466329,2,Hungarian Experimental and Clinical Pharmacology Society,http://www.mapharm.hu
77500791,3,Korean Association for Clinical Oncology (KACO),https://www.ksmo.or.kr/eng/
77508096,1,Infection Prevention Society,http://www.ips.uk.net/
77728970,1,European Society of Veterinary and Comparative Nutrition,http://www.esvcn.eu/
78091837,1,Kiel Institute for the World Economy,https://www.ifw-kiel.de/
78190159,1,Neuroscience Peer Review Consortium,http://nprc.incf.org/
78331093,1,Animals & Society Institute,http://www.animalsandsociety.org/
78512408,1,Agricultural Food and Human Values Society (AFHVS),https://afhvs.wildapricot.org/
78735424,1,Cognitive Science Society,http://www.cognitivesciencesociety.org/
78843499,1,The Coastal Society,https://thecoastalsociety.org
79074319,3,Association for Psychological Science,https://www.psychologicalscience.org/
79135273,1,British Sociological Association,http://www.britsoc.co.uk/
79142966,1,the International Labor Organization,
79187626,3,http://www.esvd.org/,FALSE
79974643,1,AEJMC Advertising Division,http://www.aejmc.org/home/2013/01/adv/
79984219,1,British Small Animal Veterinary Association,http://www.bsava.com/
80334769,2,Neuroscience Peer Review Consortium,http://nprc.incf.org/
80614181,1,Economic Research Forum,https://www.erf.org.eg/
80967739,1,French National Center for Scientific Research (CNRS),http://www.cnrs.fr/index.html%20
81098524,2,Deutsche Gesellschaft für Pädiatrische Kardiologie (DGPK),http://www.kinderkardiologie.org/
81521204,1,International Network for Social Network Analysis,http://www.insna.org/
81547547,1,International Association for Hydro-Environment Engineering,http://www.iahr.org/
81587429,1,Mathematical Association of America,https://www.maa.org/
81699576,1,Hammill Institute on Disabilities,http://www.hammill-institute.org/
82432819,1,Japanese Teratology Society,http://jts.umin.jp/en/index.html
82984449,1,National Council on Measurement in Education,http://www.ncme.org/
83251063,2,European Association for the Study of Diabetes,https://www.easd.org/
83386566,1,Human Factors and Ergonomics Society,http://www.hfes.org/
84272931,1,American Society for Reproductive Immunology,http://theasri.org/
84695101,1,Crop Science Society of America,https://www.crops.org/
84895730,1,GIGA German Institute of Global and Area Studies,https://www.giga-hamburg.de/en
85153969,1,Akadémiai Kiadó,https://akjournals.com/view/journals/168/168-overview.xml?rskey=bMzBpM&result=32
86387881,1,Triological Society,http://www.triological.org/
86486980,1,Japan Society for Reproductive Medicine,http://www.jsrm.or.jp/en/index.html
86674104,2,Association of Vascular Access & InTerventionAl Renal Physicians (AVATAR),https://www.avatar.net.in/
87123477,1,Council of European Aerospace Societies,https://ceas.org/
87184256,2,Royal Belgian Society of Laboratory Medicine,
87403961,1,"Centre for Chinese Media and Comparative Communication Research, The Chinese University of Hong Kong",http://www.com.cuhk.edu.hk/c-centre/chinese/index.html
88220793,1,StataCorp LLC,https://www.stata.com/
88439605,1,Human Factors and Ergonomics Society,http://www.hfes.org/
88760654,1,Japan Geriatrics Society,http://www.jpn-geriat-soc.or.jp/
89533336,2,The Division for Research of The Council for Exceptional Children,http://www.cecdr.org/
89865888,1,British Society for Immunology,http://www.immunology.org/
90314269,1,MPSA,http://www.mpsanet.org/
90347677,1,The International Society for Quality of Life Research (ISOQOL),http://isoqol.org/
90392387,1,Economic Society of South Africa,http://www.essa.org.za/
90626604,1,European Society for Trauma and Emergency Surgery,http://www.estesonline.org/
90729755,2,European Academy of Andrology,http://www.andrologyacademy.net/
91511648,1,Nordic International Studies Association,https://nordicisa.eu/
91749377,1,Society for Tropical Veterinary Medicine,http://www.soctropvetmed.org/
91956071,1,Eastern Communication Association (ECA),http://www.ecasite.org/
92316360,1,British Society for Geomorphology (BSG),http://www.geomorphology.org.uk/
92625435,1,International Society of Blood Transfusion,http://www.isbt-web.org/
92638099,2,International Photodynamic Association,https://www.internationalphotodynamic.com/
92685437,2,Deutsche Gesellschaft für Unfallchirurgie (DGU),http://www.dgu-online.de/
92940341,1,China Academy of Chinese Medical Sciences,http://www.catcm.ac.cn/
93175750,1,International Society for Language Studies,http://www.isls.co/
93410275,2,Italian Society of Vitreoretinal Surgeons,https://www.springer.com/journal/givre.it
93534766,1,International Society for Influenza and other Respiratory Virus Diseases,http://www.isirv.org/site/
93646482,2,Society of Fire Protection Engineers (SFPE),http://www.sfpe.org/
93932044,1,Council for Exceptional Children,http://www.cec.sped.org/
94011184,1,American Academy of School Psychology,https://www.omicsonline.org/societies/american-academy-of-school-psychology-aasp/
94020291,1,College of Sexual and Relationship Therapists,https://www.cosrt.org.uk/
94180312,1,Asian Pacific Association for the Study of the Liver,http://www.apasl.info/
94622921,1,Swedish Association of Behavioural Therapists,http://www.kbt.nu/hem/default.asp
95018974,1,The Royal Australian and New Zealand College of Ophthalmologists,
95601074,1,"Institute of Materials, Minerals and Mining",https://www.iom3.org/
96871409,1,European Association of Urology,http://www.uroweb.org/
97886924,1,OBM Network,http://www.obmnetwork.com/
98546363,1,German Chemists,http://www.gdch.de/
98631280,1,Gesellschaft Österreichischer Chemiker (GÖCH),https://www.goech.at/
99068972,2,Follow CJEM on Twitter,https://twitter.com/CJEMonline
99131542,2,The Asian Sleep Research Society,http://www.asrsonline.org/
99453086,1,International Sports Engineering Association,http://www.sportsengineering.co.uk/
99574856,1,National Society of Genetic Counselors,https://www.nsgc.org/
99619495,1,Asian Pacific Society of Nephrology,http://www.apsneph.org/
99961174,1,International Association for the Seismic Performance of Non-Structural Elements (SPONSE).,http://www.sponse.eu/
100167944,1,American Psychological Association Division 1 (Society for General Psychology),https://www.apa.org/about/division/div1.aspx
100227592,1,"Official publication of EUROSPINE, The Spine Society of Europe",https://www.eurospine.org/
100564699,1,European Social Work Research Association,http://eswra.org/
100946473,1,Brazilian Anesthesiology Society,http://www.scielo.br/
101120184,1,Istituto Affari Internazionali,http://www.iai.it/en
101458791,1,English Province of the Order,http://english.op.org/
103234284,1,Japanese Society of Developmental Biologists,http://www.jsdb.jp/english/index.html
103311983,1,American Academy of Advertising,http://www.aaasite.org/
103518591,1,"The Polymer Society, Taipei",http://www.pst.org.tw/main.php
103568991,1,Chinese Automatic Control Society,
103663982,2,European Federation of Conservative Dentistry (EFCD),http://www.efcd.eu/
103913600,1,Japan Society of Clinical Oncology,http://www.jsco.or.jp/english/
103961758,1,French Society of Blood Transfusion,https://www.sfts.asso.fr/association/sfts
104032499,1,Open and Distance Learning Association of Australia Inc,http://www.odlaa.org/
104442948,1,Association of Otolaryngologists of India,http://www.aoiho.org/
105044966,3,http://www.counseling.org/,FALSE
105662685,1,German Society for Biological Psychiatry,https://www.dgbp.de/home/
105693234,2,Institute of Mathematical Statistics,https://imstat.org/
105928092,1,International Federation of Automatic Control,https://www.ifac-control.org/
106099243,1,Association of Schools and Programs of Public Health,https://www.aspph.org/
106501229,1,Euro Fed Lipid,http://www.eurofedlipid.org/
106555721,2,Council for Children with Behavioral Disorders,http://www.ccbd.net/home
106663814,1,"Department of Psychology, University of Allahabad",http://www.allduniv.ac.in/index.php?option=com_k2&view=item&id=49:department-of-psychology&Itemid=250
107707151,1,The Society for Research on the Cerebellum,http://www.thesrca.org/
108239708,3,JLCA,https://lca-forum.org
108358066,2,Danish Resuscitation Council,https://genoplivning.dk/
108875122,1,International Society for Quality of Life Studies,https://www.isqols.org
109016753,1,Japanese Society for Oral and Maxillofacial Radiology,https://www.jsomfr.org/
109723506,1,The Society for Research in Child Development,http://www.srcd.org/
109998069,1,College on Problems of Drug Dependence,http://cpdd.org/
110358141,2,Academic Journal Publishing Center of Tianjin University,http://journals.tju.edu.cn/
110410232,1,Hospital for Special Surgery,https://www.hss.edu/
110643388,1,Optometry Australia,http://www.optometry.org.au/
111084217,1,Association for Environmental Archaeology (AEA),http://envarch.net/
111163638,1,International Society for Heart Research,https://ishrworld.org/
111181672,1,American Association for Aerosol Research,http://www.aaar.org/
111228885,1,The Optical Society of Japan,http://myosj.or.jp/en/
111367495,2,Korea Society of Waste Management (KSWM),http://www.kswm.or.kr/english/html/sub_01.asp
111690571,1,International Association for Cognitive Psychotherapy,http://www.the-iacp.com
111876535,1,"Microcirculatory Society, Inc",http://microcirc.org/
111985066,1,International Society of Electrochemistry,https://www.ise-online.org/
112292781,1,Society for Historical Archaeology,https://sha.org/
112377731,1,British Oculoplastic Surgery Society,
112620617,2,North American Simulation and Gaming Association,http://nasaga.org/
113871862,1,International Society for Affective Disorders,https://www.isad.org.uk/
113872774,1,FICS,http://www.srlf.org/en/home/
114020440,1,Association for Psychological Science,http://www.psychologicalscience.org/
114289926,1,American Association of Sexuality Educators Counselors and Therapists,https://www.aasect.org/
114306650,1,Institution of Mechanical Engineers,http://www.imeche.org/home
114499311,1,Society of Plastics Engineers,
115206073,1,Akadémiai Kiadó,https://akjournals.com/view/journals/11192/11192-overview.xml?rskey=yzIgbN&result=77
115217459,1,"BCIG, ACIA, SACIG, CCICG and WHCISG",http://www.tandfonline.com/action/journalInformation?show=societyInformation&journalCode=YCII
116012647,1,American College of Emergency Physicians,http://www.acep.org/
116051058,1,American Evaluation Association,http://www.eval.org/
116094739,1,The Society of Tribologists and Lubrication Engineers (STLE),https://www.stle.org/
116565926,1,Academy of Criminal Justice Sciences,http://www.acjs.org/
116826539,1,"The Minerals, Metals & Materials Society (TMS)",https://www.springer.com/journal/11837/updates/17302370
116955675,1,Japanese Association of Financial Economics and Engineering,http://www.jafee.gr.jp/
117562080,1,Earthquake Engineering Research Institute (EERI),https://www.eeri.org/
118549787,1,European Law Faculties Association (ELFA),http://www.elfa-afde.org/
118554956,1,Religious Research Association,http://www.rraweb.org/
119146558,1,The International Society for Developmental Psychobiology (ISDP),https://isdp.org/
119477091,1,European Federation for Pharmaceutical Sciences (EUFEPS),http://www.eufeps.org/
119714264,1,ASPHO - The American Society of Pediatric Hematology/Oncology,http://www.aspho.org/
119912628,1,The Microbiological Society of Korea,http://www.msk.or.kr/msk/main.asp
119914596,1,Deutsche Sepsis-Gesellschaft,https://www.sepsis-gesellschaft.de/
120133624,1,Southern Criminal Justice Association,https://www.southerncj.org/
120226629,1,Conference of Socialist Economists,http://www.cseweb.org.uk/
120256695,1,European Atherosclerosis Society,http://www.eas-society.org/
120873902,1,The Society of Socionetwork Strategies,http://www.kansai-u.ac.jp/riss/en/index.html
121529132,1,Royal Anthropological Institute,http://www.therai.org.uk/
121762105,1,International Neuromodulation Society,http://www.neuromodulation.com/
121779305,1,International Symbiosis Society,http://iss.cloverpad.org/
